Microsoft Windows [Version 10.0.17134.829]
(c) 2018 Microsoft Corporation. All rights reserved.

C:\Users\kkwtp-pc>sqlplus

SQL*Plus: Release 11.2.0.2.0 Production on Wed Jul 3 13:08:57 2019

Copyright (c) 1982, 2014, Oracle.  All rights reserved.

Enter user-name: system
Enter password:

Connected to:
Oracle Database 11g Express Edition Release 11.2.0.2.0 - 64bit Production

SQL> @C:\oraclexe\app\oracle\product\11.2.0\server\rdbms\admin\utlsampl
Disconnected from Oracle Database 11g Express Edition Release 11.2.0.2.0 - 64bit Production

C:\Users\kkwtp-pc>sqlplus scott/tiger

SQL*Plus: Release 11.2.0.2.0 Production on Wed Jul 3 13:10:13 2019

Copyright (c) 1982, 2014, Oracle.  All rights reserved.


Connected to:
Oracle Database 11g Express Edition Release 11.2.0.2.0 - 64bit Production

SQL> select * from emp;

     EMPNO ENAME      JOB              MGR HIREDATE         SAL       COMM
---------- ---------- --------- ---------- --------- ---------- ----------
    DEPTNO
----------
      7369 SMITH      CLERK           7902 17-DEC-80        800
        20

      7499 ALLEN      SALESMAN        7698 20-FEB-81       1600        300
        30

      7521 WARD       SALESMAN        7698 22-FEB-81       1250        500
        30


     EMPNO ENAME      JOB              MGR HIREDATE         SAL       COMM
---------- ---------- --------- ---------- --------- ---------- ----------
    DEPTNO
----------
      7566 JONES      MANAGER         7839 02-APR-81       2975
        20

      7654 MARTIN     SALESMAN        7698 28-SEP-81       1250       1400
        30

      7698 BLAKE      MANAGER         7839 01-MAY-81       2850
        30


     EMPNO ENAME      JOB              MGR HIREDATE         SAL       COMM
---------- ---------- --------- ---------- --------- ---------- ----------
    DEPTNO
----------
      7782 CLARK      MANAGER         7839 09-JUN-81       2450
        10

      7788 SCOTT      ANALYST         7566 19-APR-87       3000
        20

      7839 KING       PRESIDENT            17-NOV-81       5000
        10


     EMPNO ENAME      JOB              MGR HIREDATE         SAL       COMM
---------- ---------- --------- ---------- --------- ---------- ----------
    DEPTNO
----------
      7844 TURNER     SALESMAN        7698 08-SEP-81       1500          0
        30

      7876 ADAMS      CLERK           7788 23-MAY-87       1100
        20

      7900 JAMES      CLERK           7698 03-DEC-81        950
        30


     EMPNO ENAME      JOB              MGR HIREDATE         SAL       COMM
---------- ---------- --------- ---------- --------- ---------- ----------
    DEPTNO
----------
      7902 FORD       ANALYST         7566 03-DEC-81       3000
        20

      7934 MILLER     CLERK           7782 23-JAN-82       1300
        10


14 rows selected.

SQL> select * from dept;

    DEPTNO DNAME          LOC
---------- -------------- -------------
        10 ACCOUNTING     NEW YORK
        20 RESEARCH       DALLAS
        30 SALES          CHICAGO
        40 OPERATIONS     BOSTON

SQL> set linesize 100
SQL> set pagesize 100
SQL> select * from emp;

     EMPNO ENAME      JOB              MGR HIREDATE         SAL       COMM     DEPTNO
---------- ---------- --------- ---------- --------- ---------- ---------- ----------
      7369 SMITH      CLERK           7902 17-DEC-80        800                    20
      7499 ALLEN      SALESMAN        7698 20-FEB-81       1600        300         30
      7521 WARD       SALESMAN        7698 22-FEB-81       1250        500         30
      7566 JONES      MANAGER         7839 02-APR-81       2975                    20
      7654 MARTIN     SALESMAN        7698 28-SEP-81       1250       1400         30
      7698 BLAKE      MANAGER         7839 01-MAY-81       2850                    30
      7782 CLARK      MANAGER         7839 09-JUN-81       2450                    10
      7788 SCOTT      ANALYST         7566 19-APR-87       3000                    20
      7839 KING       PRESIDENT            17-NOV-81       5000                    10
      7844 TURNER     SALESMAN        7698 08-SEP-81       1500          0         30
      7876 ADAMS      CLERK           7788 23-MAY-87       1100                    20
      7900 JAMES      CLERK           7698 03-DEC-81        950                    30
      7902 FORD       ANALYST         7566 03-DEC-81       3000                    20
      7934 MILLER     CLERK           7782 23-JAN-82       1300                    10

14 rows selected.

SQL> select * from dept;

    DEPTNO DNAME          LOC
---------- -------------- -------------
        10 ACCOUNTING     NEW YORK
        20 RESEARCH       DALLAS
        30 SALES          CHICAGO
        40 OPERATIONS     BOSTON

SQL> delete from emp where deptno= (select deptno from emp where dname= 'sales');
delete from emp where deptno= (select deptno from emp where dname= 'sales')
                                                            *
ERROR at line 1:
ORA-00904: "DNAME": invalid identifier


SQL> delete from emp where deptno= (select deptno from dept where dname= 'sales');

0 rows deleted.

SQL> SELECT from emp where deptno= (select deptno from dept where dname= 'sales');
SELECT from emp where deptno= (select deptno from dept where dname= 'sales')
       *
ERROR at line 1:
ORA-00936: missing expression


SQL> SELECT * from emp where deptno= (select deptno from dept where dname= 'sales');

no rows selected

SQL> CONN SYSTEM/0
Connected.
SQL> CREATE USER zensar IDENTIFIED BY zensar;

User created.

SQL> conn zensar/zensar
ERROR:
ORA-01045: user ZENSAR lacks CREATE SESSION privilege; logon denied


Warning: You are no longer connected to ORACLE.
SQL> conn zensar/zensar@orcl12c
ERROR:
ORA-12154: TNS:could not resolve the connect identifier specified


SQL> ;
  1* CREATE USER zensar IDENTIFIED BY zensar
SQL> conn system/oracle
ERROR:
ORA-01017: invalid username/password; logon denied


SQL> conn system/0
Connected.
SQL> GRANT connect, RESOURCE TO zensar;

Grant succeeded.

SQL> conn scott/tiger
Connected.
SQL> show user
USER is "SCOTT"
SQL>   select * from emp where empno= 7900;

     EMPNO ENAME      JOB              MGR HIREDATE         SAL       COMM     DEPTNO
---------- ---------- --------- ---------- --------- ---------- ---------- ----------
      7900 JAMES      CLERK           7698 03-DEC-81        950                    30

SQL> GRANT SELECT ON emp to zensar;

Grant succeeded.

SQL> //permission granted

Grant succeeded.

SQL> GRANT UPDATE ON emp to zensar;

Grant succeeded.

SQL> SELECT * FROM EMP;

     EMPNO ENAME      JOB              MGR HIREDATE         SAL       COMM     DEPTNO
---------- ---------- --------- ---------- --------- ---------- ---------- ----------
      7369 SMITH      CLERK           7902 17-DEC-80        800                    20
      7499 ALLEN      SALESMAN        7698 20-FEB-81       1600        300         30
      7521 WARD       SALESMAN        7698 22-FEB-81       1250        500         30
      7566 JONES      MANAGER         7839 02-APR-81       2975                    20
      7654 MARTIN     SALESMAN        7698 28-SEP-81       1250       1400         30
      7698 BLAKE      MANAGER         7839 01-MAY-81       2850                    30
      7782 CLARK      MANAGER         7839 09-JUN-81       2450                    10
      7788 SCOTT      ANALYST         7566 19-APR-87       3000                    20
      7839 KING       PRESIDENT            17-NOV-81       5000                    10
      7844 TURNER     SALESMAN        7698 08-SEP-81       1500          0         30
      7876 ADAMS      CLERK           7788 23-MAY-87       1100                    20
      7900 JAMES      CLERK           7698 03-DEC-81        950                    30
      7902 FORD       ANALYST         7566 03-DEC-81       3000                    20
      7934 MILLER     CLERK           7782 23-JAN-82       1300                    10

14 rows selected.

SQL> SELECT * FROM EMP;

     EMPNO ENAME      JOB              MGR HIREDATE         SAL       COMM     DEPTNO
---------- ---------- --------- ---------- --------- ---------- ---------- ----------
      7369 SMITH      CLERK           7902 17-DEC-80        800                    20
      7499 ALLEN      SALESMAN        7698 20-FEB-81       1600        300         30
      7521 WARD       SALESMAN        7698 22-FEB-81       1250        500         30
      7566 JONES      MANAGER         7839 02-APR-81       2975                    20
      7654 MARTIN     SALESMAN        7698 28-SEP-81       1250       1400         30
      7698 BLAKE      MANAGER         7839 01-MAY-81       2850                    30
      7782 CLARK      MANAGER         7839 09-JUN-81       2450                    10
      7788 SCOTT      ANALYST         7566 19-APR-87       3000                    20
      7839 KING       PRESIDENT            17-NOV-81       5000                    10
      7844 TURNER     SALESMAN        7698 08-SEP-81       1500          0         30
      7876 ADAMS      CLERK           7788 23-MAY-87       1100                    20
      7900 JAMES      CLERK           7698 03-DEC-81        850                    30
      7902 FORD       ANALYST         7566 03-DEC-81       3000                    20
      7934 MILLER     CLERK           7782 23-JAN-82       1300                    10

14 rows selected.

SQL> UPDATE emp SET SAL= SAL+ 100 WHERE EMPNO= 7900;

1 row updated.

SQL> SELECT * FROM EMP;

     EMPNO ENAME      JOB              MGR HIREDATE         SAL       COMM     DEPTNO
---------- ---------- --------- ---------- --------- ---------- ---------- ----------
      7369 SMITH      CLERK           7902 17-DEC-80        800                    20
      7499 ALLEN      SALESMAN        7698 20-FEB-81       1600        300         30
      7521 WARD       SALESMAN        7698 22-FEB-81       1250        500         30
      7566 JONES      MANAGER         7839 02-APR-81       2975                    20
      7654 MARTIN     SALESMAN        7698 28-SEP-81       1250       1400         30
      7698 BLAKE      MANAGER         7839 01-MAY-81       2850                    30
      7782 CLARK      MANAGER         7839 09-JUN-81       2450                    10
      7788 SCOTT      ANALYST         7566 19-APR-87       3000                    20
      7839 KING       PRESIDENT            17-NOV-81       5000                    10
      7844 TURNER     SALESMAN        7698 08-SEP-81       1500          0         30
      7876 ADAMS      CLERK           7788 23-MAY-87       1100                    20
      7900 JAMES      CLERK           7698 03-DEC-81        950                    30
      7902 FORD       ANALYST         7566 03-DEC-81       3000                    20
      7934 MILLER     CLERK           7782 23-JAN-82       1300                    10

14 rows selected.

SQL> COMMIT;

Commit complete.

SQL> UPDATE emp SET SAL= SAL+ 100 WHERE EMPNO= 7900;

1 row updated.

SQL> ROLLBACK;

Rollback complete.

SQL> SELECT * FROM EMP;

     EMPNO ENAME      JOB              MGR HIREDATE         SAL       COMM     DEPTNO
---------- ---------- --------- ---------- --------- ---------- ---------- ----------
      7369 SMITH      CLERK           7902 17-DEC-80        800                    20
      7499 ALLEN      SALESMAN        7698 20-FEB-81       1600        300         30
      7521 WARD       SALESMAN        7698 22-FEB-81       1250        500         30
      7566 JONES      MANAGER         7839 02-APR-81       2975                    20
      7654 MARTIN     SALESMAN        7698 28-SEP-81       1250       1400         30
      7698 BLAKE      MANAGER         7839 01-MAY-81       2850                    30
      7782 CLARK      MANAGER         7839 09-JUN-81       2450                    10
      7788 SCOTT      ANALYST         7566 19-APR-87       3000                    20
      7839 KING       PRESIDENT            17-NOV-81       5000                    10
      7844 TURNER     SALESMAN        7698 08-SEP-81       1500          0         30
      7876 ADAMS      CLERK           7788 23-MAY-87       1100                    20
      7900 JAMES      CLERK           7698 03-DEC-81        950                    30
      7902 FORD       ANALYST         7566 03-DEC-81       3000                    20
      7934 MILLER     CLERK           7782 23-JAN-82       1300                    10

14 rows selected.

SQL> SELECT * FROM EMP;

     EMPNO ENAME      JOB              MGR HIREDATE         SAL       COMM     DEPTNO
---------- ---------- --------- ---------- --------- ---------- ---------- ----------
      7369 SMITH      CLERK           7902 17-DEC-80        800                    20
      7499 ALLEN      SALESMAN        7698 20-FEB-81       1600        300         30
      7521 WARD       SALESMAN        7698 22-FEB-81       1250        500         30
      7566 JONES      MANAGER         7839 02-APR-81       2975                    20
      7654 MARTIN     SALESMAN        7698 28-SEP-81       1250       1400         30
      7698 BLAKE      MANAGER         7839 01-MAY-81       2850                    30
      7782 CLARK      MANAGER         7839 09-JUN-81       2450                    10
      7788 SCOTT      ANALYST         7566 19-APR-87       3000                    20
      7839 KING       PRESIDENT            17-NOV-81       5000                    10
      7844 TURNER     SALESMAN        7698 08-SEP-81       1500          0         30
      7876 ADAMS      CLERK           7788 23-MAY-87       1100                    20
      7900 JAMES      CLERK           7698 03-DEC-81        850                    30
      7902 FORD       ANALYST         7566 03-DEC-81       3000                    20
      7934 MILLER     CLERK           7782 23-JAN-82       1300                    10

14 rows selected.

SQL> UPDATE emp SET SAL= SAL+ 100 WHERE EMPNO= 7900;

1 row updated.

SQL> COMMIT
  2  ;

Commit complete.

SQL> UPDATE EMP SET SAL= SAL+ 100 WHERE EMPNO= 7900;

1 row updated.

SQL> SELECT * FROM EMP;

     EMPNO ENAME      JOB              MGR HIREDATE         SAL       COMM     DEPTNO
---------- ---------- --------- ---------- --------- ---------- ---------- ----------
      7369 SMITH      CLERK           7902 17-DEC-80        800                    20
      7499 ALLEN      SALESMAN        7698 20-FEB-81       1600        300         30
      7521 WARD       SALESMAN        7698 22-FEB-81       1250        500         30
      7566 JONES      MANAGER         7839 02-APR-81       2975                    20
      7654 MARTIN     SALESMAN        7698 28-SEP-81       1250       1400         30
      7698 BLAKE      MANAGER         7839 01-MAY-81       2850                    30
      7782 CLARK      MANAGER         7839 09-JUN-81       2450                    10
      7788 SCOTT      ANALYST         7566 19-APR-87       3000                    20
      7839 KING       PRESIDENT            17-NOV-81       5000                    10
      7844 TURNER     SALESMAN        7698 08-SEP-81       1500          0         30
      7876 ADAMS      CLERK           7788 23-MAY-87       1100                    20
      7900 JAMES      CLERK           7698 03-DEC-81       1150                    30
      7902 FORD       ANALYST         7566 03-DEC-81       3000                    20
      7934 MILLER     CLERK           7782 23-JAN-82       1300                    10

14 rows selected.

SQL> COMMIT;

Commit complete.

SQL> SELECT * FROM EMP;

     EMPNO ENAME      JOB              MGR HIREDATE         SAL       COMM     DEPTNO
---------- ---------- --------- ---------- --------- ---------- ---------- ----------
      7369 SMITH      CLERK           7902 17-DEC-80        800                    20
      7499 ALLEN      SALESMAN        7698 20-FEB-81       1600        300         30
      7521 WARD       SALESMAN        7698 22-FEB-81       1250        500         30
      7566 JONES      MANAGER         7839 02-APR-81       2975                    20
      7654 MARTIN     SALESMAN        7698 28-SEP-81       1250       1400         30
      7698 BLAKE      MANAGER         7839 01-MAY-81       2850                    30
      7782 CLARK      MANAGER         7839 09-JUN-81       2450                    10
      7788 SCOTT      ANALYST         7566 19-APR-87       3000                    20
      7839 KING       PRESIDENT            17-NOV-81       5000                    10
      7844 TURNER     SALESMAN        7698 08-SEP-81       1500          0         30
      7876 ADAMS      CLERK           7788 23-MAY-87       1100                    20
      7900 JAMES      CLERK           7698 03-DEC-81       1150                    30
      7902 FORD       ANALYST         7566 03-DEC-81       3000                    20
      7934 MILLER     CLERK           7782 23-JAN-82       1300                    10

14 rows selected.

SQL> UPDATE EMP SET SAL= SAL+ 100 WHERE EMPNO= 7900 FOR UPDATE NOWAIT;
UPDATE EMP SET SAL= SAL+ 100 WHERE EMPNO= 7900 FOR UPDATE NOWAIT
                                               *
ERROR at line 1:
ORA-00933: SQL command not properly ended


SQL> SELECT * FROM EMP WHERE EMPNO= 7900 FOR UPDATE NOWAIT;
SELECT * FROM EMP WHERE EMPNO= 7900 FOR UPDATE NOWAIT
              *
ERROR at line 1:
ORA-00054: resource busy and acquire with NOWAIT specified or timeout expired


SQL> COMMIT;

Commit complete.

SQL> SELECT * FROM EMP WHERE EMPNO= 7900;

     EMPNO ENAME      JOB              MGR HIREDATE         SAL       COMM     DEPTNO
---------- ---------- --------- ---------- --------- ---------- ---------- ----------
      7900 JAMES      CLERK           7698 03-DEC-81       1150                    30

SQL> SELECT * FROM EMP WHERE EMPNO= 7900;

     EMPNO ENAME      JOB              MGR HIREDATE         SAL       COMM     DEPTNO
---------- ---------- --------- ---------- --------- ---------- ---------- ----------
      7900 JAMES      CLERK           7698 03-DEC-81       1150                    30

SQL> UPDATE EMP SET SAL= SAL+ 100 WHERE EMPNO= 7900 FOR UPDATE NOWAIT;
UPDATE EMP SET SAL= SAL+ 100 WHERE EMPNO= 7900 FOR UPDATE NOWAIT
                                               *
ERROR at line 1:
ORA-00933: SQL command not properly ended


SQL> UPDATE EMP SET SAL= SAL+ 100 WHERE EMPNO= 7900;

1 row updated.

SQL> REVOKE SELECT ON EMP FROM ZENSAR;

Revoke succeeded.

SQL>